C,"Tylecek, R; Sára, R",,"Kimmel, R; Klette, R; Sugimoto, A",,"Tylecek, Radim; Sara, Radim",,,A Weak Structure Model for Regular Pattern Recognition Applied to Facade Images,"COMPUTER VISION-ACCV 2010, PT I",Lecture Notes in Computer Science,,,Proceedings Paper,10th Asian Conference on Computer Vision (ACCV),"NOV 08-12, 2010","Queenstown, NEW ZEALAND",,,,,"We propose a novel method for recognition of structured images and demonstrate it on detection of windows in facade images. Given an ability to obtain local low-level data evidence on primitive elements of a structure (like window in a facade image), we determine their most probable number, attribute values (location, size) and neighborhood relation. The embedded structure is weakly modeled by pair-wise attribute constraints, which allow structure and attribute constraints to mutually support each other. We use a very general framework of reversible jump MCMC, which allows simple implementation of a specific structure model and plug-in of almost arbitrary element classifiers. The MC controls the classifier by prescribing it where to look, without wasting too much time on unpromising locations. We have chosen the domain of window recognition in facade images to demonstrate that the result is an efficient algorithm achieving performance of other strongly informed methods for regular structures like grids, while our general model covers loosely regular configurations as well.","[Tylecek, Radim; Sara, Radim] Czech Tech Univ, Ctr Machine Percept, Fac Elect Engn, CR-16635 Prague, Czech Republic",Czech Technical University Prague,"Tylecek, R (corresponding author), Czech Tech Univ, Ctr Machine Percept, Fac Elect Engn, CR-16635 Prague, Czech Republic.",,,,,,,,,1,3,,,,,,,,,,,,2011,6492,,I,,,,450,463,,,,,,,"Computer Science, Artificial Intelligence; Computer Science, Theory & Methods",,,,,,,,2024-01-16,WOS:000296690900035,View Full Record in Web of Science
J,"Summa, S; Mircoli, A; Potena, D; Ulpiani, G; Diamantini, C; Di Perna, C",,,,"Summa, Serena; Mircoli, Alex; Potena, Domenico; Ulpiani, Giulia; Diamantini, Claudia; Di Perna, Costanzo",,,Combining artificial intelligence and building engineering technologies towards energy efficiency: the case of ventilated facades,CONSTRUCTION INNOVATION-ENGLAND,,,,Article; Early Access,,,,,,Ventilated facades; Machine learning; Temperature prediction; Climate change; Experimental study,PERFORMANCE; PCM,"Purpose Nearly 75% of EU buildings are not energy-efficient enough to meet the international climate goals, which triggers the need to develop sustainable construction techniques with high degree of resilience against climate change. In this context, a promising construction technique is represented by ventilated facades (VFs). This paper aims to propose three different VFs and the authors define a novel machine learning-based approach to evaluate and predict their energy performance under different boundary conditions, without the need for expensive on-site experimentations Design/methodology/approach The approach is based on the use of machine learning algorithms for the evaluation of different VF configurations and allows for the prediction of the temperatures in the cavities and of the heat fluxes. The authors trained different regression algorithms and obtained low prediction errors, in particular for temperatures. The authors used such models to simulate the thermo-physical behavior of the VFs and determined the most energy-efficient design variant. Findings The authors found that regression trees allow for an accurate simulation of the thermal behavior of VFs. The authors also studied feature weights to determine the most relevant thermo-physical parameters. Finally, the authors determined the best design variant and the optimal air velocity in the cavity. Originality/value This study is unique in four main aspects: the thermo-dynamic analysis is performed under different thermal masses, positions of the cavity and geometries; the VFs are mated with a controlled ventilation system, used to parameterize the thermodynamic behavior under stepwise variations of the air inflow; temperatures and heat fluxes are predicted through machine learning models; the best configuration is determined through simulations, with no onerous in situ experimentations needed.","[Summa, Serena; Ulpiani, Giulia; Di Perna, Costanzo] Univ Politecn Marche, Fac Ingn, Dept Ind Engn & Math Sci, Ancona, Italy; [Mircoli, Alex; Potena, Domenico; Diamantini, Claudia] Univ Politecn Marche, Fac Ingn, Dept Informat Engn, Ancona, Italy",Marche Polytechnic University; Marche Polytechnic University,"Mircoli, A (corresponding author), Univ Politecn Marche, Fac Ingn, Dept Informat Engn, Ancona, Italy.",s.summa@pm.univpm.it; a.mircoli@univpm.it; d.potena@univpm.it; giuliaulpiani@gmail.com; c.diamantini@univpm.it; c.diperna@univpm.it,,,,,,,,0,0,,,,,,,,,,,2022 JUN 22,2022,,,,,,,,,,10.1108/CI-11-2021-0229,http://dx.doi.org/10.1108/CI-11-2021-0229,,JUN 2022,,Construction & Building Technology,,,,,,,,2024-01-16,WOS:000813410600001,View Full Record in Web of Science
C,"Shih, PH; Chi, KH",,"Ahram, T; Karwowski, W; Pickl, S; Taiar, R",,"Shih, Po-Hsiang; Chi, Kuang-Hui",,,A Deep Learning Application for Detecting Facade Tile Degradation,HUMAN SYSTEMS ENGINEERING AND DESIGN II,Advances in Intelligent Systems and Computing,,,Proceedings Paper,2nd International Conference on Human Systems Engineering and Design (IHSED) - Future Trends and Applications,"SEP 16-18, 2019","Univ Bundeswehr Munchen, Munich, GERMANY",,Univ Bundeswehr Munchen,Machine learning; Deep learning; Convolutional neural network; Defect detection; Image processing; AlexNet,,"Facade tiles of buildings are likely to weaken, crack, or fall off due to aging or out of natural causes such as temperature variations during daytime and nighttime and earthquakes. Tile spalling of tall buildings often leads to accidents or even severe casualties. In view that a routine thorough inspection is costly, this study aims to develop a cost-effective means to detect facade tile degradation of tall buildings through machine learning. We leverage a drone to film outer walls of high-rise buildings at several dozens of sites, from which training data are produced for learning and validation. We resort to a convolutional neural network with deep learning capabilities that is trained with sufficient knowledge to identify hazardous conditions of cracked tiles in two or three levels. Core to our implementation is Jetson TX2-an embedded system-which is programmed in light of AlexNet over Keras and TensorFlow, opensource libraries for deep neural network programming. To heighten learning quality subject to limited amount of training data, image preprocessing involving gray-level transformation, thresholding, and morphological operations is introduced. Experimental results corroborate that our scheme achieves a correct classification rate of over 86%. Our development serves a moderate approach to deep learning in daily contexts, a practical scenario over which to inspire other applications.","[Shih, Po-Hsiang; Chi, Kuang-Hui] Natl Yunlin Univ Sci & Technol, Dept Elect Engn, 123,Univ Rd Sect 3, Touliu 640, Yunlin, Taiwan",National Yunlin University Science & Technology,"Chi, KH (corresponding author), Natl Yunlin Univ Sci & Technol, Dept Elect Engn, 123,Univ Rd Sect 3, Touliu 640, Yunlin, Taiwan.",m10512021@yuntech.edu.tw; chikh@yuntech.edu.tw,,,,,,,,2,2,,,,,,,,,,,,2020,1026,,,,,,26,32,,10.1007/978-3-030-27928-8_5,http://dx.doi.org/10.1007/978-3-030-27928-8_5,,,,"Computer Science, Artificial Intelligence; Computer Science, Cybernetics; Engineering, Industrial",,,,,,,,2024-01-16,WOS:000625366900005,View Full Record in Web of Science
C,"Hensel, S; Goebbels, S; Kada, M",,"Sousa, AA; Havran, V; Braz, J; Bouatouch, K",,"Hensel, Simon; Goebbels, Steffen; Kada, Martin",,,LSTM Architectures for Facade Structure Completion,"GRAPP: PROCEEDINGS OF THE 16TH INTERNATIONAL JOINT CONFERENCE ON COMPUTER VISION, IMAGING AND COMPUTER GRAPHICS THEORY AND APPLICATIONS - VOL. 1: GRAPP",,,,Proceedings Paper,"16th International Joint Conference on Computer Vision, Imaging and Computer Graphics Theory and Applications (VISIGRAPP) / 16th International Conference on Computer Graphics Theory and Applications (GRAPP)","FEB 08-10, 2021",ELECTR NETWORK,,,Deep Learning; LSTM; Facade Reconstruction; Structure Completion,,"3D city models are often generated from oblique aerial images and photogrammetric point clouds. In contrast to roof surfaces, facades can not directly be reconstructed in a similar high level of quality from this data. Distortions of perspective might appear in images, due to the camera angle. Occlusions and shadowing occur as well. Objects, such as windows and doors, will have to be detected on such data if facades are to be reconstructed. Although one can use inpainting techniques to cover occluded areas, detection results are often incomplete and noisy. Formal grammars can then be used to align and add objects. However, it is difficult to find suitable rules for all types of buildings. We propose a post-processing approach based on neural networks to improve facade layouts. To this end, we applied existing Recurrent Neural Network architectures like Multi-Dimensional Long Short-term Memory Network and Quasi Recurrent Neural Network in a new context. We also propose a novel architecture, the Rotated Multi-Dimensional Long Short Term Memory. In order to deal with two-dimensional neighborhoods this architecture combines four two-dimensional Multi-Dimensional Long Short-term Memory Networks on rotated images. We could improve the quality of detection results on the Graz50 data set.","[Hensel, Simon; Goebbels, Steffen] Niederrhein Univ Appl Sci, Inst Pattern Recognit, Reinarzstr 49, Krefeld, Germany; [Kada, Martin] Tech Univ Berlin, Inst Geodesy & Geoinformat Sci, Kaiserin Augusta Allee 104-106, Berlin, Germany",Technical University of Berlin,"Hensel, S (corresponding author), Niederrhein Univ Appl Sci, Inst Pattern Recognit, Reinarzstr 49, Krefeld, Germany.",,,,,,,,,0,0,,,,,,,,,,,,2021,,,,,,,15,24,,10.5220/0010194400150024,http://dx.doi.org/10.5220/0010194400150024,,,,"Computer Science, Artificial Intelligence; Computer Science, Theory & Methods; Imaging Science & Photographic Technology",,,,,,,,2024-01-16,WOS:000661346500001,View Full Record in Web of Science
J,"Wang, YZ; Ma, YQ; Zhu, AX; Zhao, H; Liao, LX",,,,"Wang, Yongzhi; Ma, Yuqing; Zhu, A-xing; Zhao, Hui; Liao, Lixia",,,Accurate facade feature extraction method for buildings from three-dimensional point cloud data considering structural information,ISPRS JOURNAL OF PHOTOGRAMMETRY AND REMOTE SENSING,,,,Article,,,,,,Three-dimensional point cloud data; Two-dimensional optical images; Structural information; Facade features; Three-dimensional building modeling,LINE SEGMENT DETECTOR; LIDAR DATA,"Facade features represent segmentations of building surfaces and can serve as a building framework. Extracting facade features from three-dimensional (3D) point cloud data (3D PCD) is an efficient method for 3D building modeling. By combining the advantages of 3D PCD and two-dimensional optical images, this study describes the creation of a highly accurate building facade feature extraction method from 3D PCD with a focus on structural information. The new extraction method involves three major steps: image feature extraction, exploration of the mapping method between the image features and 3D PCD, and optimization of the initial 3D PCD facade features considering structural information. Results show that the new method can extract the 3D PCD facade features of buildings more accurately and continuously. The new method is validated using a case study. In addition, the effectiveness of the new method is demonstrated by comparing it with the range image-extraction method and the optical image-extraction method in the absence of structural information. The 3D PCD facade features extracted by the new method can be applied in many fields, such as 3D building modeling and building information modeling. (C) 2017 International Society for Photogrammetry and Remote Sensing, Inc. (ISPRS). Published by Elsevier B.V. All rights reserved.","[Wang, Yongzhi; Ma, Yuqing; Zhao, Hui; Liao, Lixia] Jiangxi Univ Sci & Technol, Sch Architectural & Surveying & Mapping Engn, Ganzhou, Peoples R China; [Zhu, A-xing] Nanjing Normal Univ, Key Lab Virtual Geog Environm, Nanjing, Jiangsu, Peoples R China; [Zhu, A-xing] State Key Lab Cultivat Base Geog Environm Evolut, Nanjing, Jiangsu, Peoples R China; [Zhu, A-xing] Chinese Acad Sci, Inst Geog Sci & Nat Resources Res, State Key Lab Resources & Environm Informat Syst, Beijing, Peoples R China; [Zhu, A-xing] Univ Wisconsin, Dept Geog, Madison, WI 53706 USA; [Zhu, A-xing] Jiangsu Ctr Collaborat Innovat Geog Informat Res, Nanjing, Jiangsu, Peoples R China","Jiangxi University of Science & Technology; Nanjing Normal University; Chinese Academy of Sciences; Institute of Geographic Sciences & Natural Resources Research, CAS; University of Wisconsin System; University of Wisconsin Madison","Zhu, AX (corresponding author), Nanjing Normal Univ, Key Lab Virtual Geog Environm, Nanjing, Jiangsu, Peoples R China.",gisstarnnu@gmail.com; azhu@wisc.edu,,,,,,,,23,27,,,,,,,,,,,MAY,2018,139,,,,,,146,153,,10.1016/j.isprsjprs.2017.11.015,http://dx.doi.org/10.1016/j.isprsjprs.2017.11.015,,,,"Geography, Physical; Geosciences, Multidisciplinary; Remote Sensing; Imaging Science & Photographic Technology",,,,,,,,2024-01-16,WOS:000431160100011,View Full Record in Web of Science
C,"Kutrzynski, M; Zak, B; Telec, Z; Trawinski, B",,"Nguyen, NT; Iliadis, L; Maglogiannis, I; Trawinski, B",,"Kutrzynski, Marcin; Zak, Bartosz; Telec, Zbigniew; Trawinski, Bogdan",,,Deep Learning Models for Architectural Facade Detection in Spherical Images,COMPUTATIONAL COLLECTIVE INTELLIGENCE (ICCCI 2021),Lecture Notes in Artificial Intelligence,,,Proceedings Paper,13th International Conference on Computational Collective Intelligence (ICCCI),"SEP 29-OCT 01, 2021","Democritus Univ Thrace, Rhodes, GREECE",,Democritus Univ Thrace,Deep learning; Facade segmentation; Object detection; Spherical images; Region-based convolutional neural networks,,"Maintaining a public register by extracting urban objects from photos taken in the city is one of the most important tasks for municipal services. It is of great importance in the field of protection and shaping of the cultural landscape, protection of monuments, and registration of the urban tissue development. The current state of the art shows that deep learning models (DL models) can cope with the problem of extracting urban objects with the same or better performance than non-DL models, and can process video and photos automatically. This paper compares the three main DL models for facade instance detection and facade segmentation: Mask R-CNN, YOLACT, and Mask-Scoring R-CNN. The training and validation datasets used for transfer learning were created on the basis of spherical photos taken in an artificially generated virtual city. The test dataset, on the other hand, included spherical facade photos taken in a real city. The comparative analysis of the DL models was performed using parametric and nonparametric statistical tests for pairwise and multiple comparisons.","[Kutrzynski, Marcin; Zak, Bartosz; Telec, Zbigniew; Trawinski, Bogdan] Wroclaw Univ Sci & Technol, Dept Appl Informat, Wroclaw, Poland",Wroclaw University of Science & Technology,"Trawinski, B (corresponding author), Wroclaw Univ Sci & Technol, Dept Appl Informat, Wroclaw, Poland.",marcin.kutrzynski@pwr.edu.pl; zbigniew.telec@pwr.edu.pl; bogdan.trawinski@pwr.edu.pl,,,,,,,,0,0,,,,,,,,,,,,2021,12876,,,,,,536,548,,10.1007/978-3-030-88081-1_40,http://dx.doi.org/10.1007/978-3-030-88081-1_40,,,,"Computer Science, Artificial Intelligence",,,,,,,,2024-01-16,WOS:000866521400040,View Full Record in Web of Science
J,"Guo, JJ; Wang, Q; Li, YT",,,,"Guo, Jingjing; Wang, Qian; Li, Yiting",,,Evaluation-oriented facade defects detection using rule-based deep learning method,AUTOMATION IN CONSTRUCTION,,,,Article,,,,,,Condition evaluation; Facade defects; Rule-based deep learning; Evaluation area,CONVOLUTIONAL NEURAL-NETWORKS; DAMAGE DETECTION; INSPECTION; MAINTENANCE; SYSTEMS,"Visual evaluation of facade condition plays an important role to ensure the structural health of the whole building. To automatically achieve visual evaluation of facade condition with high accuracy, current studies have applied various machine learning and deep learning algorithms to classify, localize, and segment the defects. However, the methods in previous research mainly focused on accuracy improvement rather than providing effective evaluations of defects according to the requirement of industry standards. Therefore, this study proposes a rule-based deep learning method to achieve evaluation-oriented facade defects detection, which can be used to provide effective evaluation areas containing the necessary information (e.g., type, location, quantity, and size of facade defects) for condition evaluation. First, annotation rules for classification, segmentation, and localization are designed to instruct the manual annotation work and automatically adjust the bounding boxes into effective evaluation areas. Then, a proposal weighting rule is developed to be combined with the deep learning model during the model training process to improve the accuracy and stability of the predictions. A rectification rule is further used to adjust the raw predictions into predictions with effective evaluation areas for facade defects. Experiments conducted in this study demonstrated that using the proposed method can successfully improve the performance of facade defects detection to meet the requirement of condition evaluation. Besides, this method is tested to be adaptable to various distance settings in the requirement.","[Guo, Jingjing; Wang, Qian] Natl Univ Singapore, Sch Design & Environm, Dept Built Environm, Singapore 117566, Singapore; [Li, Yiting] Natl Univ Singapore, Dept Elect & Comp Engn, Fac Engn, Singapore 117583, Singapore",National University of Singapore; National University of Singapore,"Wang, Q (corresponding author), Natl Univ Singapore, Sch Design & Environm, Dept Built Environm, Singapore 117566, Singapore.",bdgwang@nus.edu.sg,,,,,,,,12,12,,,,,,,,,,,NOV,2021,131,,,,,,,,103910,10.1016/j.autcon.2021.103910,http://dx.doi.org/10.1016/j.autcon.2021.103910,,AUG 2021,,"Construction & Building Technology; Engineering, Civil",,,,,,,,2024-01-16,WOS:000696957700006,View Full Record in Web of Science
J,"Liu, HT; Xu, YH; Zhang, JL; Zhu, JK; Li, Y; Hoi, SCH",,,,"Liu, Hantang; Xu, Yinghao; Zhang, Jialiang; Zhu, Jianke; Li, Yang; Hoi, Steven C. H.",,,DeepFacade: A Deep Learning Approach to Facade Parsing With Symmetric Loss,IEEE TRANSACTIONS ON MULTIMEDIA,,,,Article,,,,,,Shape; Windows; Microsoft Windows; Grammar; Deep learning; Semantics; Facade parsing; deep learning; semantic segmentation,SEGMENTATION,"Parsing building facades into procedural grammars plays an important role for 3D building model generation tasks, which have been long desired in computer vision. Deep learning is a promising approach to facade parsing, however, a straightforward solution by directly applying standard deep learning approaches cannot always yield the optimal results. This is primarily due to two reasons: 1) it is nontrivial to train existing semantic segmentation networks for facade parsing, e.g., Fully-Convolutional Neural Networks (FCN) which are usually weak at predicting fine-grained shapes (J. Long et al., 2015); and 2) building facades are man-made architectures with highly regularized shape priors, and the prior knowledge plays an important role in facade parsing, for which how to integrate the prior knowledge into deep neural networks remains an open problem. In this paper, we present a novel symmetric loss function that can be used in deep neural networks for end-to-end training. This novel loss is based on the assumption that most of windows and doors have a highly symmetric rectangle shape, and it penalizes all window predictions that are non-rectangles. This prior knowledge is smoothly integrated into the end-to-end training process. Quantitative evaluation demonstrates that our method has outperformed previous state-of-art methods significantly on five popular facade parsing datasets. Qualitative results have shown that our method effectively aids deep convolutional neural networks to predict more accurate, visually pleasing, and symmetric shapes. To the best of our knowledge, we are the first to incorporate symmetry constraint into end-to-end training in deep neural networks for facade parsing.","[Liu, Hantang; Xu, Yinghao; Zhang, Jialiang; Zhu, Jianke; Li, Yang] Zhejiang Univ, Coll Comp Sci, Hangzhou 310027, Peoples R China; [Zhu, Jianke] Alibaba Zhejiang Univ Joint Res Inst Frontier Tec, Hangzhou 310027, Peoples R China; [Hoi, Steven C. H.] Singapore Management Univ, Singapore 178902, Singapore",Zhejiang University; Singapore Management University,"Zhu, JK (corresponding author), Zhejiang Univ, Coll Comp Sci, Hangzhou 310027, Peoples R China.",liuhantang@zju.edu.cn; 3150103924@zju.edu.cn; zjialiang@zju.edu.cn; jkzhu@zju.edu.cn; liyang89@zju.edu.cn; chhoi@smu.edu.sg,,,,,,,,24,26,,,,,,,,,,,DEC,2020,22,12,,,,,3153,3165,,10.1109/TMM.2020.2971431,http://dx.doi.org/10.1109/TMM.2020.2971431,,,,"Computer Science, Information Systems; Computer Science, Software Engineering; Telecommunications",,,,,,,,2024-01-16,WOS:000591817700011,View Full Record in Web of Science
J,"Guo, JJ; Wang, Q; Su, S; Li, YT",,,,"Guo, Jingjing; Wang, Qian; Su, Shu; Li, Yiting",,,Informativeness-guided active learning for deep learning-based facade defects detection,COMPUTER-AIDED CIVIL AND INFRASTRUCTURE ENGINEERING,,,,Article,,,,,,,METHODOLOGY; NETWORK,"Annotation work is burdensome and challenging for developing a facade defects detector, especially when the raw data set is large but not all useful. To alleviate the problem, this study proposes an informativeness-guided active learning methodology to effectively select informative data to train a robust facade defects detector. A novel data annotation workflow is developed to ensure the high quality of labels. Then, an active learning-based model training strategy is adopted to enable the model to have both the abilities of generalization and discrimination on different defect features. Besides, an innovative informativeness assessment method is proposed by flexibly combining the degree of uncertainty and the degree of representativeness. Through the proposed method, the performance of facade defects detection can be further boosted with the same amount but more informative training data so that the cost-efficiency of human annotation work can be improved.","[Guo, Jingjing] Hunan Univ, Coll Civil Engn, Changsha, Hunan, Peoples R China; [Wang, Qian; Su, Shu] Southeast Univ, Sch Civil Engn, Dept Construct & Real Estate, Nanjing 211189, Jiangsu, Peoples R China; [Li, Yiting] Natl Univ Singapore, Fac Engn, Dept Elect & Comp Engn, Singapore, Singapore",Hunan University; Southeast University - China; National University of Singapore,"Wang, Q (corresponding author), Southeast Univ, Sch Civil Engn, Dept Construct & Real Estate, Nanjing 211189, Jiangsu, Peoples R China.",qianwang@seu.edu.cn,,,,,,,,5,5,,,,,,,,,,,NOV,2023,38,17,,,SI,,2408,2425,,10.1111/mice.12998,http://dx.doi.org/10.1111/mice.12998,,MAR 2023,,"Computer Science, Interdisciplinary Applications; Construction & Building Technology; Engineering, Civil; Transportation Science & Technology",,,,,,,,2024-01-16,WOS:000953629100001,View Full Record in Web of Science
