J,"Tsay, YS; Yeh, CY; Chen, YH; Lu, MC; Lin, YC",,,,"Tsay, Yaw-Shyan; Yeh, Chiu-Yu; Chen, Yu-Han; Lu, Mei-Chen; Lin, Yu-Chen",,,A Machine Learning-Based Prediction Model of LCCO2 for Building Envelope Renovation in Taiwan,SUSTAINABILITY,,,,Article,,,,,,life-cycle CO2; energy consumption; building envelope renovation; row houses; machine learning; supervised learning,ENERGY PERFORMANCE; SUSTAINABILITY; EMISSIONS; DESIGN,"In 2015, Taiwan's government announced the Greenhouse Gas Reduction and Management Act, the goal of which was a 50% reduction in carbon emissions by 2050, compared with 2005. The residential and commercial sectors produce approximately one third of all carbon emissions in Taiwan, and the number of construction renovation projects is much larger than that of new construction projects. In this paper, we considered the life-cycle CO2 (LCCO2) of a building envelope renovation project in Tainan and focused on local construction methods for typical row houses. The LCCO2 of 744 cases with various climate zones, orientations, and insulation and glazing types was calculated via EnergyPlus, SimaPro, and a local database (LCBA database), and the results were then used to develop a machine learning model. Our findings showed that the machine learning model was capable of predicting annual energy consumption and LCCO2. With regard to annual energy consumption, the RMSE was 227.09 kW center dot h (per year) and the R-2 was 0.992. For LCCO2, the RMSE was 2792.47 kgCO(2)eq and the R-2 was 0.989, which indicates a high-confidence process for decision making in the early stages of building design and renovation.","[Tsay, Yaw-Shyan; Yeh, Chiu-Yu; Chen, Yu-Han; Lu, Mei-Chen; Lin, Yu-Chen] Natl Cheng Kung Univ, Dept Architecture, Tainan 701, Taiwan",National Cheng Kung University,"Tsay, YS (corresponding author), Natl Cheng Kung Univ, Dept Architecture, Tainan 701, Taiwan.",tsayys@mail.ncku.edu.tw; vvv590@gmail.com; b10333225@gmail.com; mei101546@gmail.com; big21832524@gmail.com,,,,,,,,5,5,,,,,,,,,,,AUG,2021,13,15,,,,,,,8209,10.3390/su13158209,http://dx.doi.org/10.3390/su13158209,,,,Green & Sustainable Science & Technology; Environmental Sciences; Environmental Studies,,,,,,,,2024-01-16,WOS:000682321700001,View Full Record in Web of Science
J,"Zhai, YJ; Gong, RY; Huo, JZ; Fan, BB",,,,"Zhai, Yujia; Gong, Ruoyu; Huo, Junzi; Fan, Binbin",,,"Building Facade Color Distribution, Color Harmony and Diversity in Relation to Street Functions: Using Street View Images and Deep Learning",ISPRS INTERNATIONAL JOURNAL OF GEO-INFORMATION,,,,Article,,,,,,building facade color; street function; color harmony; color diversity; deep learning,PLAN,"Building facade colors play an important role in influencing urban imageability, attraction and citizens' experience. However, the relations between street functions and the building facade color distribution, color harmony and color diversity have not been thoroughly examined. We obtained the dominant colors of building facades in Changning District, Shanghai, utilizing Baidu street view images, image semantic segmentation technology and the K-means algorithm. The variations in building facades' dominant colors, color harmony and diversity across different types of functional streets were examined through logistic regression and ANOVA analyses. The results indicate that, compared to industrial streets, red hues are more common in science education streets, residential streets and mixed functional streets. Business streets are more likely to have hues of green, red and red-purple. Residential streets' saturation is overall higher than that of industrial streets. In business streets, the medium-high value occurs less frequently than other streets. Moreover, we found that the street building facade colors in industrial streets were more harmonious and less diversified than that in other functional streets. This study has implications for urban color planning practices. Color harmony and color diversity should be well considered in future planning. The role of street functions should also be addressed in building facade color planning, to improve existing planning frameworks as well as related strategies.","[Zhai, Yujia; Gong, Ruoyu; Huo, Junzi; Fan, Binbin] Tongji Univ, Coll Architecture & Urban Planning, Shanghai 200092, Peoples R China",Tongji University,"Zhai, YJ (corresponding author), Tongji Univ, Coll Architecture & Urban Planning, Shanghai 200092, Peoples R China.",zhai@tongji.edu.cn,,,,,,,,1,1,,,,,,,,,,,JUN,2023,12,6,,,,,,,224,10.3390/ijgi12060224,http://dx.doi.org/10.3390/ijgi12060224,,,,"Computer Science, Information Systems; Geography, Physical; Remote Sensing",,,,,,,,2024-01-16,WOS:001014873300001,View Full Record in Web of Science
J,"Weerasinghe, NP; Yang, RJ; Wang, C",,,,"Weerasinghe, Nilmini Pradeepika; Yang, Rebecca Jing; Wang, Chen",,,Learning from success: A machine learning approach to guiding solar building envelope applications in non-domestic market,JOURNAL OF CLEANER PRODUCTION,,,,Article,,,,,,Building integrated photovoltaics (BIPV); Machine learning; Support vector machine; Decision-making; Solar building applications,INTEGRATED PHOTOVOLTAICS; PERFORMANCE; SYSTEMS; ENERGY,"Solar building envelopes, also known as Building Integrated PV (BIPV) show significant growth in Asia and Europe, although other regions such as Australia are still lagging. The decision to uptake BIPV is complex due to the heterogeneous interest of adopters and multi-dimensional features. Instead of redesigning BIPV in hypothetical buildings, we built a machine learning model using a database of real BIPV and building-attached PV (BAPV) applications, for the purpose of learning and predicting a BIPV adoption decision-making in nondomestic buildings in western countries. We used Australia as a case study to execute the support vector machine (SVM) prediction model. It was revealed that the combination of project determinants such as geographical conditions, equivalent building materials, interest rates and capital cost influenced the decision of BIPV. The prediction model provides pieces of information for stakeholders across the BIPV ecosystem to take their decision on investment, policymaking, and research directions. The current global industry transformation and innovations in technology are favourable to politically promoting and investing in BIPV. Such promotion and investment would help both expand the current market and reach the greenhouse targets.","[Wang, Chen] RMIT Univ, Sch Engieering, Melbourne, Australia; [Yang, Rebecca Jing] RMIT Univ, Sch Property Construct & Project Management, Melbourne, Australia; [Yang, Rebecca Jing] CSIRO, Software & Computat Syst Program SCS, Data61, Canberra, Australia",Royal Melbourne Institute of Technology (RMIT); Royal Melbourne Institute of Technology (RMIT); Commonwealth Scientific & Industrial Research Organisation (CSIRO),"Yang, RJ (corresponding author), RMIT Univ, Sch Property Construct & Project Management, Melbourne, Australia.",Nilmini.weerasinghe@rmit.edu.au; Rebecca.yang@rmit.edu.au; Chen.Wang@data61.csiro.au,,,,,,,,4,4,,,,,,,,,,,NOV 10,2022,374,,,,,,,,133997,10.1016/j.jclepro.2022.133997,http://dx.doi.org/10.1016/j.jclepro.2022.133997,,SEP 2022,,"Green & Sustainable Science & Technology; Engineering, Environmental; Environmental Sciences",,,,,,,,2024-01-16,WOS:000862711100005,View Full Record in Web of Science
J,"Zhao, SH; Wang, L; Qian, XM; Chen, JP",,,,"Zhao, Shenghuan; Wang, Luo; Qian, Xueming; Chen, Jianping",,,Enhancing performance-based generative architectural design with sketch-based image retrieval: a pilot study on designing building facade fenestrations,VISUAL COMPUTER,,,,Article,,,,,,Computer-aided design; Geometric computation; Design method; Artificial intelligence; Sketch-based image retrieval (SBIR),MULTIOBJECTIVE OPTIMIZATION,"By coupling parametric modelling, building performance (like energy efficiency) simulation, and algorithmic optimization, performance-based generative architectural design (PGAD) can automatically generate lots of high-performance architectural design solutions. Although it is 'performance-based', the final selection of a real design project still needs to consider the aesthetics of design choices. However, due to the overwhelming number of design choices generated by PGAD, it is difficult for designers to choose the most favourable one from them. Therefore, the current study tries to integrate the technology of sketch-based image retrieval (SBIR) into the selecting stage of PGAD. Rather than navigating alternatives one from another and getting lost, designers can directly find the most aesthetically preferred one by inputting his/her hand-drawn design. A design project of fenestrating a multiple-floor office building is used to demonstrate this method and test three SBIR algorithms: Angular radial partitioning (ARP), Angular radial orientation partitioning (AROP), and Sketch-A-Net model (SAN). Test results show that AROP performs the best among these three algorithms. Its retrievals are most similar to inquiry images drawn by architects. Meanwhile, performances of AROP with different template combinations are also rated. After that, AROP with the best template is also tested with incompletely drawn inquiry images. In the end, investigation results are validated by another building facade design case. The current study automates the PGAD process stepwise, making it more applicable to real design projects.","[Zhao, Shenghuan; Chen, Jianping] Suzhou Univ Sci & Technol, Sch Architecture & Urban Planning, Suzhou, Peoples R China; [Zhao, Shenghuan; Chen, Jianping] Suzhou Univ Sci & Technol, Jiangsu Key Lab Intelligent Bldg Energy Efficienc, Suzhou, Peoples R China; [Wang, Luo; Qian, Xueming] Xi An Jiao Tong Univ, Sch Informat & Commun Engn, Xian, Peoples R China; [Chen, Jianping] Suzhou Univ Sci & Technol, Sch Elect & Informat Engn, Suzhou, Peoples R China",Suzhou University of Science & Technology; Suzhou University of Science & Technology; Xi'an Jiaotong University; Suzhou University of Science & Technology,"Chen, JP (corresponding author), Suzhou Univ Sci & Technol, Sch Architecture & Urban Planning, Suzhou, Peoples R China.;Chen, JP (corresponding author), Suzhou Univ Sci & Technol, Jiangsu Key Lab Intelligent Bldg Energy Efficienc, Suzhou, Peoples R China.;Chen, JP (corresponding author), Suzhou Univ Sci & Technol, Sch Elect & Informat Engn, Suzhou, Peoples R China.",alanjpchen@yahoo.com,,,,,,,,0,0,,,,,,,,,,,AUG,2022,38,8,,,,,2981,2997,,10.1007/s00371-021-02170-x,http://dx.doi.org/10.1007/s00371-021-02170-x,,JUN 2021,,"Computer Science, Software Engineering",,,,,,,,2024-01-16,WOS:000660360700003,View Full Record in Web of Science
J,"Wang, LJ; Zhao, QH",,,,"Wang, Lijuan; Zhao, Qihua",,,Deformation Analysis and Research of Building Envelope by Deep Learning Technology under the Reinforcement of the Diaphragm Wall,COMPUTATIONAL INTELLIGENCE AND NEUROSCIENCE,,,,Article,,,,,,,STATIONS,"The safety analysis of underground buildings is the most crucial problem in the construction industry. This work aims to optimize the safety analysis results of the underground building envelope and comprehensively improve the safety of the underground building. Long short-term memory (LSTM) can make long-term and short-term predictions, thus reducing the model's prediction error. Applying it to the deformation analysis, data prediction of the underground building envelope can improve the accuracy of the deformation prediction of the envelope. This work deeply discusses deep learning technology and the principle of the LSTM model. Based on the safety analysis concept of the underground building envelope, LSTM underground building envelope deformation's prediction model is established and comprehensively evaluated. The results show that in the prediction of horizontal displacement of foundation pit pile of diaphragm wall, the mean relative error (MRE) of the prediction results of the designed model range in 10%-18%, and the calculation time ranges 15-36 s. In the settlement displacement prediction, the model's MRE is within the range of 5%-7%, and the calculation time is within the range of 17-40 s. With the increase of training times, the prediction accuracy of the model increases, and the calculation time becomes relatively stable. Compared with other models, the relative error of prediction results is about 5.4% at the highest and 1.8% at the lowest. This work provides technical support for improving the safety prediction accuracy of the underground building envelope and provides some reference value for the comprehensive development of the underground building industry.","[Wang, Lijuan; Zhao, Qihua] Chengdu Univ Technol, State Key Lab GeoHazard Prevent & Geoenvironm Prot, Chengdu 610059, Peoples R China",Chengdu University of Technology,"Zhao, QH (corresponding author), Chengdu Univ Technol, State Key Lab GeoHazard Prevent & Geoenvironm Prot, Chengdu 610059, Peoples R China.",wanglj1019@163.com; qhzhao310@163.com,,,,,,,,0,0,,,,,,,,,,,SEP 14,2022,2022,,,,,,,,9489445,10.1155/2022/9489445,http://dx.doi.org/10.1155/2022/9489445,,,,Mathematical & Computational Biology; Neurosciences,,,,,,,,2024-01-16,WOS:000864450000003,View Full Record in Web of Science
J,"Chaiyasarn, K; Buatik, A",,,,"Chaiyasarn, Krisada; Buatik, Apichat",,,TILE DAMAGE DETECTION IN TEMPLE FACADE VIA CONVOLUTIONAL NEURAL NETWORKS,JOURNAL OF ENGINEERING SCIENCE AND TECHNOLOGY,,,,Article,,,,,,Computer vision; Convolutional neural network; Historical temple; Tile's damage detection; Unmanned aerial vehicle,CLASSIFICATION; SCALE,"Many tiles on facade of historic temples are damaged and deteriorated due to aging and environmental factors. Regular inspection is required for proper maintenance and automatic inspection offers a significant advantage over manual inspection as it is efficient and accurate. Many previous studies are focus on detecting damages in factory tiles for the quality control purposes, although there has not been much study on tile damages for historical temples. This paper proposed an image-based system to detect damages in tiles using Convolutional Neural Networks (CNN) on a temple facade. The dataset was created by an Unmanned Aerial Vehicle (UAV) and a digital camera from a historical temple in Bangkok, Thailand. In the proposed work, CNN was trained on various image patches sizes. The detection accuracy of the system was found to be 95% in the validation data and 91% on the testing data. The results of the proposed system were compared with a system using hand-crafted features, including 2D wavelet transforms with the Artificial Neural Network (ANN). The proposed system shows that the CNN approach is more accurate than the traditional handcrafted method.","[Chaiyasarn, Krisada; Buatik, Apichat] Thammasat Univ, Thammasat Sch Engn, Dept Civil Engn, 99 Moo 18 Khlong Nueng, Khlong Luang 12121, Pathum Thani, Thailand",Thammasat University,"Chaiyasarn, K (corresponding author), Thammasat Univ, Thammasat Sch Engn, Dept Civil Engn, 99 Moo 18 Khlong Nueng, Khlong Luang 12121, Pathum Thani, Thailand.",ckrisada@engr.tu.ac.th,,,,,,,,1,1,,,,,,,,,,,AUG,2021,16,4,,,,,3057,3071,,,,,,,"Engineering, Multidisciplinary",,,,,,,,2024-01-16,WOS:000697583000021,View Full Record in Web of Science
J,"Katsigiannis, S; Seyedzadeh, S; Agapiou, A; Ramzan, N",,,,"Katsigiannis, Stamos; Seyedzadeh, Saleh; Agapiou, Andrew; Ramzan, Naeem",,,Deep learning for crack detection on masonry facades using limited data and transfer learning,JOURNAL OF BUILDING ENGINEERING,,,,Article,,,,,,Crack detection; Brickwork masonry; Deep learning; Convolutional neural networks; Transfer learning; Brickwork dataset,CONVOLUTIONAL NEURAL-NETWORKS; INSPECTION; CLASSIFICATION,"Crack detection in masonry facades is a crucial task for ensuring the safety and longevity of buildings. However, traditional methods are often time-consuming, expensive, and labourintensive. In recent years, deep learning techniques have been applied to detect cracks in masonry images, but these models often require large amounts of annotated data to achieve high accuracy, which can be difficult to obtain. In this article, we propose a deep learning approach for crack detection on brickwork masonry facades using transfer learning with limited annotated data. Our approach uses a pre-trained deep convolutional neural network model as a feature extractor, which is then optimised specifically for crack detection. To evaluate the effectiveness of our proposed method, we created and curated a dataset of 700 brickwork masonry facade images, and used 500 images for training, 100 for validation, and the remaining 100 images for testing. Results showed that our approach is very effective in detecting cracks, achieving an accuracy and F1-score of up to 100% when following end-to-end training of the neural network, thus being a promising solution for building inspection and maintenance, particularly in situations where annotated data is limited. Moreover, the transfer learning approach can be easily adapted to different types of masonry facades, making it a versatile tool for building inspection and maintenance.","[Katsigiannis, Stamos] Univ Durham, Durham, England; [Seyedzadeh, Saleh] Univ Edinburgh, Edinburgh, Scotland; [Agapiou, Andrew] Univ Strathclyde, Glasgow, Scotland; [Ramzan, Naeem] Univ West Scotland, Paisley, Scotland",Durham University; University of Edinburgh; University of Strathclyde; University of West Scotland,"Katsigiannis, S (corresponding author), Univ Durham, Durham, England.",stamos.katsigiannis@durham.ac.uk,,,,,,,,6,6,,,,,,,,,,,OCT 1,2023,76,,,,,,,,107105,10.1016/j.jobe.2023.107105,http://dx.doi.org/10.1016/j.jobe.2023.107105,,JUL 2023,,"Construction & Building Technology; Engineering, Civil",,,,,,,,2024-01-16,WOS:001057475800001,View Full Record in Web of Science
J,"Argiento, R; Bissiri, PG; Pievatolo, A; Scrosati, C",,,,"Argiento, Raffaele; Bissiri, Pier Giovanni; Pievatolo, Antonio; Scrosati, Chiara",,,Multilevel Functional Principal Component Analysis of Facade Sound Insulation Data,QUALITY AND RELIABILITY ENGINEERING INTERNATIONAL,,,,Article; Proceedings Paper,14th Annual Conference of the European-Network-for-Business-and-Industrial-Statistics (ENBIS),"SEP 21-25, 2014","Johannes Kepler Univ, Linz, AUSTRALIA",,Johannes Kepler Univ,facade sound insulation; repeatability and reproducibility; multilevel functional data analysis; functional depth; Bayesian functional regression,ROUND-ROBIN; UNCERTAINTY; BUILDINGS; MODELS; DEPTH,"This work analyzes data from an experimental study on facade sound insulation, consisting of independent repeated measurements executed by different laboratories on the same residential building. Mathematically, data can be seen as functions describing an acoustic parameter varying with frequency. The aim of this study is twofold. On one hand, considering the laboratory as the grouping variable, it is important to assess the within-group and between-group variability in the measurements. On the other hand, in building acoustics, it is known that sound insulation is more variable at low frequencies (from 50 to 100Hz), compared with higher frequencies (up to 5000Hz), and therefore, a multilevel functional model is employed to decompose the functional variance both at the measurement level and at the group level. This decomposition also allows for the ranking of the laboratories on the basis of measurement variability and performance at low frequencies (relative high variability) and over the whole spectrum. The former ranking is obtained via the principal component scores and the latter via an original Bayesian extension of the functional depth. Copyright (c) 2015 John Wiley & Sons, Ltd.","[Argiento, Raffaele; Bissiri, Pier Giovanni; Pievatolo, Antonio] CNR, IMATI, I-20133 Milan, Italy; [Scrosati, Chiara] CNR, ITC, I-20133 Milan, Italy",Consiglio Nazionale delle Ricerche (CNR); Istituto di Matematica Applicata e Tecnologie Informatiche Enrico Magenes (IMATI-CNR); Consiglio Nazionale delle Ricerche (CNR); Istituto per le Tecnologie della Costruzione (ITC-CNR),"Bissiri, PG (corresponding author), Univ Milano Bicocca, Ed U7,Via Bicocca degli Arcimboldi 8, I-20133 Milan, Italy.",pier.bissiri@unimib.it,,,,,,,,4,4,,,,,,,,,,,NOV,2015,31,7,,,SI,,1239,1253,,10.1002/qre.1843,http://dx.doi.org/10.1002/qre.1843,,,,"Engineering, Multidisciplinary; Engineering, Industrial; Operations Research & Management Science",,,,,,,,2024-01-16,WOS:000363876000013,View Full Record in Web of Science
J,"Kong, GF; Fan, HC",,,,"Kong, Gefei; Fan, Hongchao",,,Enhanced Facade Parsing for Street-Level Images Using Convolutional Neural Networks,IEEE TRANSACTIONS ON GEOSCIENCE AND REMOTE SENSING,,,,Article,,,,,,Grammar; Pipelines; Buildings; Image segmentation; Semantics; Shape; Object detection; Data set; deep learning; facade parsing; object detection; semantic segmentation,SEGMENTATION,"Facade parsing is an essential process before the 3-D modeling of digital or virtual 3-D city models. The existing grammar-based approaches for facade parsing rely on strong prior knowledge but can obtain facade parts with better structure. Pixelwise-segmentation-based approaches achieve facade parsing with much less knowledge but the resulting structure of facade parts is normally incomplete. Both these approaches are restricted by their high reliance on the data set. Therefore, they cannot be applied for facade parsing with complex scenes. To address this issue, we built a large street-level data set by taking Mapillary images as the training data for more general scenes. At the same time, we propose a new pipeline based on convolutional neural network (CNN) that combines pixelwise segmentation and global object detection to achieve better results for facade parsing. Our pipeline can be applied to facade images after rectification and street-level facade images with complex scenes. The result of the ablation study demonstrates that the design of our pipeline is effective. We test our pipeline on the classic ECP2011 data set and our new large street-level data set. Our pipeline achieves state-of-the-art results for both the data sets: an accuracy of 98.2% and the mean average precision (mAP) of 98.8% on the ECP2011 data set as well as the mAP of 81.1% for facade parts parsing on our street-level data set.","[Kong, Gefei] Wuhan Univ, Sch Remote Sensing & Informat Engn, Wuhan 430079, Peoples R China; [Fan, Hongchao] Norwegian Univ Sci & Technol, Dept Civil & Environm Engn, N-7491 Trondheim, Norway",Wuhan University; Norwegian University of Science & Technology (NTNU),"Fan, HC (corresponding author), Norwegian Univ Sci & Technol, Dept Civil & Environm Engn, N-7491 Trondheim, Norway.",gefeikong@whu.edu.cn; hongchao.fan@ntnu.no,,,,,,,,10,10,,,,,,,,,,,DEC,2021,59,12,,,,,10519,10531,,10.1109/TGRS.2020.3035878,http://dx.doi.org/10.1109/TGRS.2020.3035878,,,,"Geochemistry & Geophysics; Engineering, Electrical & Electronic; Remote Sensing; Imaging Science & Photographic Technology",,,,,,,,2024-01-16,WOS:000722170500054,View Full Record in Web of Science
J,"Rozsas, A; Slobbe, A; Huizinga, W; Kruithof, M; Pillai, KA; Kleijn, K; Giardina, G",,,,"Rozsas, Arpad; Slobbe, Arthur; Huizinga, Wyke; Kruithof, Maarten; Pillai, Krishna Ajithkumar; Kleijn, Kelvin; Giardina, Giorgia",,,Siamese Convolutional Neural Networks to Quantify Crack Pattern Similarity in Masonry Facades,INTERNATIONAL JOURNAL OF ARCHITECTURAL HERITAGE,,,,Article,,,,,,Crack patterns; deep neural network; machine learning; masonry structure; regression; similarity measure,DAMAGE; RELIABILITY; CONCRETE,"This paper proposes an automated approach to predict crack pattern similarities that correlate well with assessment by structural engineers. We use Siamese convolutional neural networks (SCNN) that take two crack pattern images as inputs and output scalar similarity measures. We focus on 2D masonry facades with and without openings. The image pairs are generated using a statistics-based approach and labelled by 28 structural engineering experts. When the data is randomly split into fit and test data, the SCNNs can achieve good performance on the test data (R-2 approximate to 0.9). When the SCNNs are tested on unseen archetypes, their test R-2 values are on average 1% lower than the case where all archetypes are seen during the training. These very good results indicate that SCNNs can generalise to unseen cases without compromising their performance. Although the analyses are restricted to the considered synthetic images, the results are promising and the approach is general.","[Rozsas, Arpad; Slobbe, Arthur; Pillai, Krishna Ajithkumar] TNO Bldg Infrastruct & Maritime, Dept Struct Reliabil, Delft, Netherlands; [Huizinga, Wyke; Kruithof, Maarten; Kleijn, Kelvin] TNO Def Safety & Secur, Dept Intelligent Imaging, The Hague, Netherlands; [Pillai, Krishna Ajithkumar; Giardina, Giorgia] Delft Univ Technol, Dept Geosci & Engn, Stevinweg 1, NL-2628 CN Delft, Netherlands",Netherlands Organization Applied Science Research; Delft University of Technology,"Giardina, G (corresponding author), Delft Univ Technol, Dept Geosci & Engn, Stevinweg 1, NL-2628 CN Delft, Netherlands.",g.giardina@tudelft.nl,,,,,,,,1,1,,,,,,,,,,,JAN 2,2023,17,1,,,SI,,147,169,,10.1080/15583058.2022.2134062,http://dx.doi.org/10.1080/15583058.2022.2134062,,OCT 2022,,"Architecture; Construction & Building Technology; Engineering, Civil",,,,,,,,2024-01-16,WOS:000876588100001,View Full Record in Web of Science
